query_image,hit_1_text,hit_1_score,hit_2_text,hit_2_score,hit_3_text,hit_3_score
camera.jpeg,త్రిపాదపై కెమెరాను చూస్తున్న వ్యక్తి,0.32638800144195557,విభజన గురించి వచనం యొక్క పేజీ,0.23731295764446259,తరగతిలో ఒక ఉపాధ్యాయుడు,0.2123352289199829
cat.jpeg,రోడ్డు మీద ఒక నల్ల పిల్లి,0.3302701413631439,ఒక నల్లటి మోటార్‌సైకిల్ గోడ పక్కన నిలబడి ఉంది,0.20438314974308014,విభజన గురించి వచనం యొక్క పేజీ,0.20191162824630737
coffee.jpeg,ఒక సాసర్ మీద ఒక కప్పు కాఫీ,0.27255475521087646,విభజన గురించి వచనం యొక్క పేజీ,0.21393558382987976,తరగతిలో ఒక ఉపాధ్యాయుడు,0.18844923377037048
girl.jpeg,తోటలో ఒక పాఠశాల అమ్మాయి,0.2801024913787842,తరగతిలో ఒక ఉపాధ్యాయుడు,0.2331881821155548,వంటగదిలో ఒక గృహిణి,0.22746287286281586
house_wife.jpeg,వంటగదిలో ఒక గృహిణి,0.25212398171424866,విభజన గురించి వచనం యొక్క పేజీ,0.19417940080165863,త్రిపాదపై కెమెరాను చూస్తున్న వ్యక్తి,0.17912530899047852
motorcycle_right.jpeg,ఒక నల్లటి మోటార్‌సైకిల్ గోడ పక్కన నిలబడి ఉంది,0.26705101132392883,రోడ్డు మీద ఒక నల్ల పిల్లి,0.23831987380981445,తరగతిలో ఒక ఉపాధ్యాయుడు,0.18678978085517883
teacher.jpeg,తరగతిలో ఒక ఉపాధ్యాయుడు,0.2788260579109192,తోటలో ఒక పాఠశాల అమ్మాయి,0.20575487613677979,విభజన గురించి వచనం యొక్క పేజీ,0.1996382176876068
page.png,విభజన గురించి వచనం యొక్క పేజీ,0.3321876525878906,తరగతిలో ఒక ఉపాధ్యాయుడు,0.15188443660736084,ఒక సాసర్ మీద ఒక కప్పు కాఫీ,0.13639917969703674
